2026-01-15 20:37:13 | INFO | P01 | =================
2026-01-15 20:37:13 | INFO | P01 | === RUN START ===
2026-01-15 20:37:13 | INFO | P01 | project=Foundations of Professional Python
2026-01-15 20:37:13 | INFO | P01 | repo_dir=datafun-01-foundations
2026-01-15 20:37:13 | INFO | P01 | python=3.14.2
2026-01-15 20:37:13 | INFO | P01 | os=Darwin 24.6.0
2026-01-15 20:37:13 | INFO | P01 | shell=zsh
2026-01-15 20:37:13 | INFO | P01 | cwd=.
2026-01-15 20:37:13 | INFO | P01 | github_actions=False
2026-01-15 20:37:13 | INFO | P01 | =================
2026-01-15 20:37:13 | INFO | P01 | START main()..................
2026-01-15 20:37:13 | INFO | P01 | Generated formatted multi-line SUMMARY string.
2026-01-15 20:37:13 | INFO | P01 | Returning the str to the calling function.
2026-01-15 20:37:13 | INFO | P01 | 
    Custom Information:
        Company name: DataFun Analytics
        Employee count: 150
        TODO: Add your other global variables below:





    
2026-01-15 20:37:13 | INFO | P01 | Generated formatted multi-line SUMMARY string.
2026-01-15 20:37:13 | INFO | P01 | Returning the str to the calling function.
2026-01-15 20:37:13 | INFO | P01 | 
    Descriptive Statistics for Snowfall (inches):
        Total snowfall: 22.50 inches
        TODO: Add your count of measurements below:

        TODO: Add your minimum and maximum snowfall below:

        Average snowfall: 4.50 inches
        TODO: Add your standard deviation below:

    
2026-01-15 20:37:13 | INFO | P01 | END main()..................
2026-01-15 21:41:08 | INFO | P01 | =================
2026-01-15 21:41:08 | INFO | P01 | === RUN START ===
2026-01-15 21:41:08 | INFO | P01 | project=Foundations of Professional Python
2026-01-15 21:41:08 | INFO | P01 | repo_dir=datafun-01-foundations
2026-01-15 21:41:08 | INFO | P01 | python=3.14.2
2026-01-15 21:41:08 | INFO | P01 | os=Darwin 24.6.0
2026-01-15 21:41:08 | INFO | P01 | shell=zsh
2026-01-15 21:41:08 | INFO | P01 | cwd=.
2026-01-15 21:41:08 | INFO | P01 | github_actions=False
2026-01-15 21:41:08 | INFO | P01 | =================
2026-01-15 21:41:08 | INFO | P01 | START main()..................
2026-01-15 21:41:08 | INFO | P01 | Generated formatted multi-line SUMMARY string.
2026-01-15 21:41:08 | INFO | P01 | Returning the str to the calling function.
2026-01-15 21:41:08 | INFO | P01 | 
    Custom Information:
        Company name: DataFun Analytics
        Employee count: 150
        TODO: Add your other global variables below:





    
2026-01-15 21:41:08 | INFO | P01 | Generated formatted multi-line SUMMARY string.
2026-01-15 21:41:08 | INFO | P01 | Returning the str to the calling function.
2026-01-15 21:41:08 | INFO | P01 | 
    Descriptive Statistics for Snowfall (inches):
        Total snowfall: 22.50 inches
        TODO: Add your count of measurements below:

        TODO: Add your minimum and maximum snowfall below:

        Average snowfall: 4.50 inches
        TODO: Add your standard deviation below:

    
2026-01-15 21:41:08 | INFO | P01 | END main()..................
2026-01-16 06:54:50 | INFO | P01 | =================
2026-01-16 06:54:50 | INFO | P01 | === RUN START ===
2026-01-16 06:54:50 | INFO | P01 | project=Foundations of Professional Python
2026-01-16 06:54:50 | INFO | P01 | repo_dir=datafun-01-foundations
2026-01-16 06:54:50 | INFO | P01 | python=3.14.2
2026-01-16 06:54:50 | INFO | P01 | os=Darwin 24.6.0
2026-01-16 06:54:50 | INFO | P01 | shell=zsh
2026-01-16 06:54:50 | INFO | P01 | cwd=.
2026-01-16 06:54:50 | INFO | P01 | github_actions=False
2026-01-16 06:54:50 | INFO | P01 | =================
2026-01-16 06:54:50 | INFO | P01 | START main()..................
2026-01-16 06:54:50 | INFO | P01 | Generated formatted multi-line SUMMARY string.
2026-01-16 06:54:50 | INFO | P01 | Returning the str to the calling function.
2026-01-16 06:54:50 | INFO | P01 | 
    Custom Information:
        Company name: DataFun Analytics
        Employee count: 150
        TODO: Add your other global variables below:





    
2026-01-16 06:54:50 | INFO | P01 | Generated formatted multi-line SUMMARY string.
2026-01-16 06:54:50 | INFO | P01 | Returning the str to the calling function.
2026-01-16 06:54:50 | INFO | P01 | 
    Descriptive Statistics for Snowfall (inches):
        Total snowfall: 22.50 inches
        TODO: Add your count of measurements below:

        TODO: Add your minimum and maximum snowfall below:

        Average snowfall: 4.50 inches
        TODO: Add your standard deviation below:

    
2026-01-16 06:54:50 | INFO | P01 | END main()..................
2026-01-16 07:07:04 | INFO | P01 | =================
2026-01-16 07:07:04 | INFO | P01 | === RUN START ===
2026-01-16 07:07:04 | INFO | P01 | project=Foundations of Professional Python
2026-01-16 07:07:04 | INFO | P01 | repo_dir=datafun-01-foundations
2026-01-16 07:07:04 | INFO | P01 | python=3.14.2
2026-01-16 07:07:04 | INFO | P01 | os=Darwin 24.6.0
2026-01-16 07:07:04 | INFO | P01 | shell=zsh
2026-01-16 07:07:04 | INFO | P01 | cwd=.
2026-01-16 07:07:04 | INFO | P01 | github_actions=False
2026-01-16 07:07:04 | INFO | P01 | =================
2026-01-16 07:07:04 | INFO | P01 | START main()..................
2026-01-16 07:07:04 | INFO | P01 | Generated formatted multi-line SUMMARY string.
2026-01-16 07:07:04 | INFO | P01 | Returning the str to the calling function.
2026-01-16 07:07:04 | INFO | P01 | 
    Custom Information:
        Company name: DataFun Analytics
        Employee count: 150
        My understanding: Getting there slowly
        My stress level: 10
        My hunger level: 7.4
        Having fun: True
        Favorite foods: ['Pizza', 'Sandwiches', 'Sushi']

    
2026-01-16 07:07:04 | INFO | P01 | Generated formatted multi-line SUMMARY string.
2026-01-16 07:07:04 | INFO | P01 | Returning the str to the calling function.
2026-01-16 07:07:04 | INFO | P01 | 
    Descriptive Statistics for Snowfall (inches):
        Total snowfall: 23.80 inches
        Count of measurements: 5
        Minimum snowfall: 2.50
        Maximum snowfall: 6.50
        Average snowfall: 4.76 inches
        Standard deviation: 1.68
    
2026-01-16 07:07:04 | INFO | P01 | END main()..................
